module,skill,display-name,menu-code,description,action,args,phase,preceded-by,followed-by,required,output-location,outputs
formally-bmad,formally-bmad-dsl-setup,Setup DSL Formally BMAD,DU,Configure DSL branch state and verify automated reasoning tools,dsl-configure,[--headless],0-dsl-setup,,formally-bmad-agent-steward:steward,true,formally_bmad_project_root,DSL setup report and initialized project state
formally-bmad,formally-bmad-agent-steward,Canonical Model Steward,ST,Maintain canonical model validation provenance and status,steward,[--headless] [task],1-steward,formally-bmad-dsl-setup:dsl-configure,formally-bmad-dsl-brainstorming:dsl-brainstorming,false,formally_bmad_canonical_model_path,canonical model status provenance and validation records
formally-bmad,formally-bmad-dsl-brainstorming,DSL Brainstorming,DB,Run the parallel DSL branch with canonical assertions ontology ASM and delta validation,dsl-brainstorming,[--headless] [brief],4b-dsl-discovery,formally-bmad-agent-steward:steward,formally-bmad-dsl-prd:dsl-prd,false,formally_bmad_project_root,dsl brainstorm artifact canonical DSL ontology ASM deltas increment validation
formally-bmad,formally-bmad-dsl-prd,DSL PRD,DP,Create PRDs grounded in accepted DSL assertions deltas and validation state,dsl-prd,[--headless] [source],5b-dsl-requirements,formally-bmad-dsl-brainstorming:dsl-brainstorming,formally-bmad-dsl-architecture:dsl-architecture,false,formally_bmad_project_root,dsl PRD accepted deltas validation posture verification obligations
formally-bmad,formally-bmad-dsl-architecture,DSL Architecture,DA,Refine the accepted DSL baseline into architecture with architecture-level deltas,dsl-architecture,[--headless] [source],6b-dsl-architecture,formally-bmad-dsl-prd:dsl-prd,formally-bmad-dsl-epics:dsl-epics,false,formally_bmad_project_root,dsl architecture artifact design decisions architecture deltas ontology and ASM refinement
formally-bmad,formally-bmad-dsl-epics,DSL Epics,DE,Map accepted DSL requirements and architecture context into evidence-aware epics,dsl-epics,[--headless] [source],7b-dsl-epics,formally-bmad-dsl-architecture:dsl-architecture,formally-bmad-dsl-stories:dsl-stories,false,formally_bmad_project_root,dsl epics coverage map accepted delta lineage validation posture story obligations
formally-bmad,formally-bmad-dsl-stories,DSL Stories,DS,Create stories that preserve DSL evidence posture delta lineage and readiness blockers,dsl-stories,[--headless] [source],8b-dsl-stories,formally-bmad-dsl-epics:dsl-epics,formally-bmad-dsl-verification:dsl-verification,false,formally_bmad_project_root,dsl stories acceptance criteria alignment blockers readiness delta lineage
formally-bmad,formally-bmad-dsl-verification,DSL Verification,DV,Run checkpoint verification over the DSL baseline deltas rechecks and readiness,dsl-verification,[--headless] [scope],12b-dsl-verification,formally-bmad-dsl-stories:dsl-stories,,false,formally_bmad_project_root,dsl verification reports baseline audits increment validation rechecks readiness
